{
  "schema": 3,
  "updated_at": "2026-01-01T09:30:00Z",
  "sources": {
    "timeline": {"enabled": true},
    "issues": {"enabled": true},
    "connections": {"enabled": true},
    "sharing": {"enabled": true},
    "jobs": {"enabled": true},
    "posts": {"enabled": true}
  },
  "watermark": "2026-01-01T09:00:00Z",
  "pinned": [
    "timeline:session.started:sample-project:11111111-1111-4111-8111-111111111111"
  ],
  "posts": [
    {
      "id": "c0ffee02",
      "ts": "2026-01-01T09:30:00Z",
      "source": "sample_agent",
      "kind": "question",
      "title": "Cap transcripts at 40 MB or stream them?",
      "body": "Capping is a 20-line change; streaming touches the watcher loop. Say which and I continue.",
      "project_id": "sample-project",
      "pid": "00000000-0000-4000-8000-000000000000",
      "link": {"view": "projects", "project": "sample-project"},
      "url": null,
      "ref": {"workitem_id": "22222222-2222-4222-8222-222222222222", "session_id": "11111111-1111-4111-8111-111111111111"}
    }
  ]
}
